run_id	timestamp	parent_ref	candidate_ref	language	design	phase	metric_name	metric_value	metric_direction	gate_status	complexity_delta	decision	runtime_minutes	idea	review_note	failure_cause
baseline_001	2026-05-04T01:45:45Z	no_git_ref	no_git_ref	stata	regulatory-notch density design plus firm-year DiD and event study	baseline	channel_separation_score	0.90	max	pass	0	keep	0.01	baseline channel-separation evaluation	current kept state classifies evidence as reporting_management	none
iterate_002	2026-05-04T01:46:12Z	baseline_001	candidate_002	stata	regulatory-notch density design plus firm-year DiD and event study	iterate	channel_separation_score	0.94	max	pass	-3	keep	0.02	simplify gate evidence parser	metric improved and driver became simpler	none
iterate_003	2026-05-04T01:46:38Z	candidate_002	candidate_003	stata	regulatory-notch density design plus firm-year DiD and event study	iterate	channel_separation_score	0.96	max	pass	8	discard	0.02	add broad exploratory proxy family	improvement below epsilon_keep and code became more complex	none
crash_004	2026-05-04T01:47:05Z	candidate_002	candidate_004	stata	regulatory-notch density design plus firm-year DiD and event study	iterate	channel_separation_score	NaN	max	fail	2	crash	45.00	add slow unrestricted timing scan	timeout exceeded fixed wall-clock budget	timeout
fixture_check_001	2026-05-08T13:56:33Z	da09699e86cb6599a68712318e2edbcae7a99925	da09699e86cb6599a68712318e2edbcae7a99925	stata	regulatory-notch density design plus firm-year DiD and event study	iterate	channel_separation_score	0.75	max	pass	0	discard	0.04	public fixture clean rerun	candidate did not clear epsilon_keep or simplicity rule	none
